{
  "schemaVersion": 1,
  "lastUpdated": "2026-10-26",
  "themes": [
    {
      "id": "planning",
      "label": "Planning & forecasting"
    },
    {
      "id": "data",
      "label": "Data & systems"
    },
    {
      "id": "ai",
      "label": "AI in finance"
    },
    {
      "id": "operating",
      "label": "Operating model"
    },
    {
      "id": "risk",
      "label": "Risk & resilience"
    },
    {
      "id": "cash",
      "label": "Cash & working capital"
    }
  ],
  "records": [
    {
      "id": "P-01",
      "theme": "planning",
      "themeLabel": "Planning & forecasting",
      "metric": "35 days",
      "title": "Median cycle time to complete the annual budget",
      "finding": "APQC reports a cross-industry median of 35 calendar days from the beginning to the end of the annual budgeting process.",
      "coverage": "10,267 companies",
      "period": null,
      "published": null,
      "type": "Cross-industry benchmark",
      "studyYear": null,
      "source": {
        "publisher": "APQC",
        "title": "APQC, measure 100160",
        "url": "https://www.apqc.org/resources/benchmarking/open-standards-benchmarking/measures/cycle-time-days-complete-annual-budget",
        "accessedOn": "2026-07-28"
      },
      "addedOn": "2026-07-28",
      "updatedOn": "2026-07-28",
      "status": "active"
    },
    {
      "id": "P-02",
      "theme": "planning",
      "themeLabel": "Planning & forecasting",
      "metric": "11 days",
      "title": "Median cycle time to prepare a financial forecast",
      "finding": "APQC reports a cross-industry median of 11 calendar days to prepare a financial forecast.",
      "coverage": "5,119 companies",
      "period": null,
      "published": null,
      "type": "Cross-industry benchmark",
      "studyYear": null,
      "source": {
        "publisher": "APQC",
        "title": "APQC, measure 100604",
        "url": "https://www.apqc.org/resources/benchmarking/open-standards-benchmarking/measures/cycle-time-days-prepare-financial",
        "accessedOn": "2026-07-28"
      },
      "addedOn": "2026-07-28",
      "updatedOn": "2026-07-28",
      "status": "active"
    },
    {
      "id": "P-03",
      "theme": "planning",
      "themeLabel": "Planning & forecasting",
      "metric": "5 days",
      "title": "Median cycle time to update a rolling forecast",
      "finding": "APQC reports a cross-industry median of five calendar days to update or revise a rolling forecast.",
      "coverage": "3,647 companies",
      "period": null,
      "published": null,
      "type": "Cross-industry benchmark",
      "studyYear": null,
      "source": {
        "publisher": "APQC",
        "title": "APQC, measure 100635",
        "url": "https://www.apqc.org/resources/benchmarking/open-standards-benchmarking/measures/cycle-time-days-updaterevise-rolling",
        "accessedOn": "2026-07-28"
      },
      "addedOn": "2026-07-28",
      "updatedOn": "2026-07-28",
      "status": "active"
    },
    {
      "id": "P-04",
      "theme": "planning",
      "themeLabel": "Planning & forecasting",
      "metric": "9.4 vs. 14.5",
      "title": "Average days required to reforecast",
      "finding": "The top 20% of AFP's agility scoring reforecast in 9.4 days, compared with 14.5 days for other respondents. Among the top group, 94% agreed or strongly agreed that FP&A uses multiple scenarios.",
      "coverage": "255 corporate practitioners",
      "period": "August-September 2022",
      "published": null,
      "type": null,
      "studyYear": 2022,
      "source": {
        "publisher": "Association for Financial Professionals",
        "title": "2022 AFP FP&A Survey",
        "url": "https://www.financialprofessionals.org/about/learn-more/press-releases/Details/survey-agile-finance-leaders-reforecast-faster-are-more-likely-to-use-scenarios-in-the-planning-process",
        "accessedOn": "2026-07-28"
      },
      "addedOn": "2026-07-28",
      "updatedOn": "2026-07-28",
      "status": "active"
    },
    {
      "id": "D-01",
      "theme": "data",
      "themeLabel": "Data & systems",
      "metric": "96% / 93%",
      "title": "Spreadsheet use in planning and reporting",
      "finding": "Ninety-six percent of respondents used spreadsheets for planning. Ninety-three percent used spreadsheets for reporting on a daily or weekly basis.",
      "coverage": "362 FP&A and finance practitioners globally",
      "period": "Fall 2024",
      "published": null,
      "type": null,
      "studyYear": 2024,
      "source": {
        "publisher": "Association for Financial Professionals",
        "title": "2025 AFP FP&A Benchmarking Survey",
        "url": "https://www.financialprofessionals.org/about/learn-more/press-releases/Details/survey-lack-of-reliable-and-accessible-data-holds-fp-a-back-from-success-with-technology",
        "accessedOn": "2026-07-28"
      },
      "addedOn": "2026-07-28",
      "updatedOn": "2026-07-28",
      "status": "active"
    },
    {
      "id": "D-02",
      "theme": "data",
      "themeLabel": "Data & systems",
      "metric": "71%",
      "title": "EPM use for planning at least quarterly",
      "finding": "Seventy-one percent of respondents used enterprise performance management tools for planning at least quarterly, and more than half used them daily or weekly.",
      "coverage": "362 FP&A and finance practitioners globally",
      "period": "Fall 2024",
      "published": null,
      "type": null,
      "studyYear": 2024,
      "source": {
        "publisher": "Association for Financial Professionals",
        "title": "2025 AFP FP&A Benchmarking Survey",
        "url": "https://www.financialprofessionals.org/about/learn-more/press-releases/Details/survey-lack-of-reliable-and-accessible-data-holds-fp-a-back-from-success-with-technology",
        "accessedOn": "2026-07-28"
      },
      "addedOn": "2026-07-28",
      "updatedOn": "2026-07-28",
      "status": "active"
    },
    {
      "id": "D-03",
      "theme": "data",
      "themeLabel": "Data & systems",
      "metric": "61% / 60%",
      "title": "Data reliability and accessibility challenges",
      "finding": "Sixty-one percent of respondents reported moderate to significant challenges with data reliability, and 60% reported challenges with data accessibility.",
      "coverage": "362 FP&A and finance practitioners globally",
      "period": "Fall 2024",
      "published": null,
      "type": null,
      "studyYear": 2024,
      "source": {
        "publisher": "Association for Financial Professionals",
        "title": "2025 AFP FP&A Benchmarking Survey",
        "url": "https://www.financialprofessionals.org/about/learn-more/press-releases/Details/survey-lack-of-reliable-and-accessible-data-holds-fp-a-back-from-success-with-technology",
        "accessedOn": "2026-07-28"
      },
      "addedOn": "2026-07-28",
      "updatedOn": "2026-07-28",
      "status": "active"
    },
    {
      "id": "D-04",
      "theme": "data",
      "themeLabel": "Data & systems",
      "metric": "8 + 10",
      "title": "Planning and reporting tool categories in quarterly use",
      "finding": "More than half of respondents reported using at least eight categories of planning tools and 10 types of reporting tools each quarter.",
      "coverage": "362 FP&A and finance practitioners globally",
      "period": "Fall 2024",
      "published": null,
      "type": null,
      "studyYear": 2024,
      "source": {
        "publisher": "Association for Financial Professionals",
        "title": "2025 AFP FP&A Benchmarking Survey",
        "url": "https://www.financialprofessionals.org/about/learn-more/press-releases/Details/survey-lack-of-reliable-and-accessible-data-holds-fp-a-back-from-success-with-technology",
        "accessedOn": "2026-07-28"
      },
      "addedOn": "2026-07-28",
      "updatedOn": "2026-07-28",
      "status": "active"
    },
    {
      "id": "D-05",
      "theme": "data",
      "themeLabel": "Data & systems",
      "metric": "96% / 93%",
      "title": "Expected growth in digital technology investment",
      "finding": "Ninety-six percent of respondents expected UK business investment in digital technology and assets to rise over the following five years, and 93% expected an increase over the following 12 months.",
      "coverage": "58 UK CFOs, including 10 FTSE 100 and 21 FTSE 250 companies",
      "period": "July 1-13, 2026",
      "published": "July 20, 2026",
      "type": "Survey expectation",
      "studyYear": 2026,
      "source": {
        "publisher": "Deloitte UK",
        "title": "Deloitte CFO Survey Q2 2026",
        "url": "https://www.deloitte.com/uk/en/about/press-room/deloitte-cfo-survey-quater-two-2026-growing-ai-optimism.html",
        "accessedOn": "2026-08-03"
      },
      "addedOn": "2026-08-03",
      "updatedOn": "2026-08-03",
      "status": "active"
    },
    {
      "id": "A-01",
      "theme": "ai",
      "themeLabel": "AI in finance",
      "metric": "23% + 40%",
      "title": "AI use and testing within FP&A",
      "finding": "Twenty-three percent of respondents used AI daily, weekly, or monthly. Another 40% were testing AI and planned implementation within the following year.",
      "coverage": "362 FP&A and finance practitioners globally",
      "period": "Fall 2024",
      "published": null,
      "type": null,
      "studyYear": 2024,
      "source": {
        "publisher": "Association for Financial Professionals",
        "title": "2025 AFP FP&A Benchmarking Survey",
        "url": "https://www.financialprofessionals.org/about/learn-more/press-releases/Details/survey-lack-of-reliable-and-accessible-data-holds-fp-a-back-from-success-with-technology",
        "accessedOn": "2026-07-28"
      },
      "addedOn": "2026-07-28",
      "updatedOn": "2026-07-28",
      "status": "active"
    },
    {
      "id": "A-02",
      "theme": "ai",
      "themeLabel": "AI in finance",
      "metric": "59%",